meta_description,city_name,neighbourhoods,is_active,province,meta_title,local_paragraph,h1_heading,phone_number,province_full,slug,id,created_date,updated_date,created_by_id,created_by,is_sample
"Looking for small movers in Markham, ON? We offer hourly moving services for apartments, condos, and small loads. Call (289) 800-2197 for a free quote.","Markham","Unionville, Cornell, Cathedraltown, Greensborough, Markham Village, Thornhill, Milliken Mills","true","ON","Markham Small & Hourly Movers | Affordable Moving Services","Markham is one of the GTA's fastest-growing cities, with high-rise condos in Unionville and family townhomes near Cornell and Cathedraltown. Whether you're moving between units in a Markham condo tower or relocating from a townhouse to a bungalow, our small moving teams handle it efficiently. We know the area well — from the tight loading docks near Highway 7 to the residential side streets in Greensborough.","Small & Hourly Movers in Markham","(289) 800-2197","Ontario","markham","6999e9dd52dd2b3e6bada99d","2026-02-21T17:22:37.530000","2026-02-21T17:22:37.530000","698695f1c74216ef773f0181","jordan@chasethevibe.ca","false"
"Affordable small movers in Scarborough, ON. Hourly rates for condos, apartments, and small loads. No hidden fees. Call (289) 800-2197 today.","Scarborough","Scarborough Town Centre, West Hill, Guildwood, Morningside, Agincourt, Malvern, Wexford","true","ON","Scarborough Small & Hourly Movers Near Me | Budget-Friendly","Scarborough is one of Toronto's most diverse and dynamic districts, with everything from high-rise towers in Scarborough Town Centre to detached homes in West Hill and Guildwood. Our small movers know the area well — from navigating the apartment complexes along Kingston Road to handling moves in quiet residential pockets near Morningside and Port Union.","Scarborough Small & Hourly Movers Near Me","(289) 800-2197","Ontario","scarborough","6999e9dd52dd2b3e6bada9a0","2026-02-21T17:22:37.530000","2026-02-21T17:22:37.530000","698695f1c74216ef773f0181","jordan@chasethevibe.ca","false"
"Small movers in Kitchener, ON offering hourly rates for apartments, condos, and small loads. Same-day available. Call (289) 800-2197 for a free quote.","Kitchener","Downtown Kitchener, Doon, Idlewood, Rockway, Pioneer Park, Stanley Park, Forest Heights","true","ON","Kitchener & Waterloo Small & Hourly Movers | Local Moving Help","Kitchener's growing downtown core and expanding suburbs mean plenty of moves happening year-round. From modern apartments near the LRT corridor to family homes in Doon and Idlewood, our small moving teams handle it all. We're familiar with the Kitchener-Waterloo area and can navigate the city's mix of new builds and established neighbourhoods efficiently.","Small & Hourly Movers in Kitchener & Waterloo","(289) 800-2197","Ontario","kitchener","6999e9dd52dd2b3e6bada99f","2026-02-21T17:22:37.530000","2026-03-04T01:36:03.283000","698695f1c74216ef773f0181","jordan@chasethevibe.ca","false"
"Need small movers in North York, ON? Hourly moving help for apartments, condos, and single-item moves. No full-truck minimums. Call (289) 800-2197.","North York","Willowdale, Don Mills, Lawrence Park, Bathurst Manor, Bayview Village, York Mills, Downsview","true","ON","North York Small & Hourly Movers Near Me | Affordable Rates","North York is a dense urban district packed with high-rise apartments, condos, and townhomes along Yonge Street and Sheppard Avenue. Our small moving teams are experienced with elevator bookings, parking restrictions, and tight building access — everything that makes moving in North York uniquely challenging. We serve neighbourhoods from Willowdale to Don Mills and beyond.","North York Small & Hourly Movers Near Me","(289) 800-2197","Ontario","north-york","6999e9dd52dd2b3e6bada99e","2026-02-21T17:22:37.530000","2026-02-21T17:22:37.530000","698695f1c74216ef773f0181","jordan@chasethevibe.ca","false"
"Small movers in Oshawa, ON with hourly rates. Perfect for apartments, condos, and small loads. Same-day available. Call (289) 800-2197 for a free quote.","Oshawa","Downtown Oshawa, Pinecrest, Eastdale, Centennial, Samac, Kedron, McLaughlin","true","ON","Oshawa Small & Hourly Movers | Affordable Moving Services","Oshawa is the heart of Durham Region, with a mix of downtown rental apartments, suburban homes in Pinecrest and Eastdale, and newer developments near the 407. Our small moving teams serve the whole Oshawa area and understand the distance dynamics between Durham Region and the rest of the GTA. Whether it's a single-bedroom move downtown or a furniture run across town, we've got you covered.","Small & Hourly Movers in Oshawa","(289) 800-2197","Ontario","oshawa","6999e9dd52dd2b3e6bada9a1","2026-02-21T17:22:37.530000","2026-02-21T17:22:37.530000","698695f1c74216ef773f0181","jordan@chasethevibe.ca","false"
"Affordable hourly moving services for apartments and condos in Hamilton. Whether it's a small load or a full apartment, we provide reliable and careful moving solutions.","Hamilton","Downtown Hamilton, Westdale, Stoney Creek, Ancaster, Dundas, Binbrook, Crown Point, Gibson","true","ON","Hamilton Apartment & Condo Movers | Hourly & Small Movers","For apartment and condo dwellers in Hamilton, our small moving services offer both convenience and value. We cover the full city — from downtown high-rises near James Street to mountain-side residences in Ancaster and Dundas — making your move effortless no matter the terrain.","Hamilton Small & Hourly Movers Near Me","(289) 800-2197","Ontario","hamilton","6996593c621530eb2807bf88","2026-02-19T00:28:44.305000","2026-02-19T00:49:34.531000","698695f1c74216ef773f0181","jordan@chasethevibe.ca","false"
"Need movers for your Brampton condo or apartment? We offer hourly rates and small move solutions for a stress-free experience. Get your free quote today!","Brampton","Bramalea, Heart Lake, Sandringham-Wellington, Downtown Brampton, Credit Valley, Vales of Castlemore, Mount Pleasant","true","ON","Small & Hourly Movers Brampton | Condo Movers","Our Brampton moving team specializes in apartment and condo relocations throughout the city. Whether you're moving within a Bramalea high-rise or relocating from one side of Downtown Brampton to another, we handle the heavy lifting so you don't have to.","Brampton Small & Hourly Movers Near Me","(289) 800-2197","Ontario","brampton","6996593c621530eb2807bf86","2026-02-19T00:28:44.305000","2026-02-19T00:50:31.883000","698695f1c74216ef773f0181","jordan@chasethevibe.ca","false"
"Looking for apartment or condo movers in London, Ontario? We offer flexible, hourly moving services for small to medium loads. Get a fast, free quote!","London","Downtown London, Old North, Wortley Village, Hyde Park, Masonville, White Oaks, Argyle, Lambeth","true","ON","London ON Apartment & Condo Movers | Small Moving","Our small moving team in London, Ontario, is built for apartment and condo relocations across the Forest City. From student apartments near Western University to downtown condos and suburban complexes in Hyde Park or Masonville, we provide reliable service at an honest hourly rate.","London Small & Hourly Movers Near Me","(289) 800-2197","Ontario","london","6996593c621530eb2807bf8a","2026-02-19T00:28:44.305000","2026-02-19T00:51:14.264000","698695f1c74216ef773f0181","jordan@chasethevibe.ca","false"
"Cheap movers for condos and apartments in Toronto. Pay by the hour for efficient, reliable movers. Get a free quote!","Toronto","Downtown, North York, Etobicoke, Scarborough, York, East York, Leslieville, Liberty Village, Yorkville, The Annex","true","ON","Toronto Condo & Apartment Movers | Small Moves & Cheap Movers","Specializing in condo and apartment moves across Toronto's vibrant neighbourhoods. Our movers navigate the city's unique challenges — from tight downtown streets and loading docks to high-rise elevator bookings — ensuring a smooth transition for every tenant.","Small, Hourly & Cheap Movers in Toronto","(289) 800-2197","Ontario","toronto","6996593c621530eb2807bf85","2026-02-19T00:28:44.305000","2026-03-07T01:24:00.625000","698695f1c74216ef773f0181","jordan@chasethevibe.ca","false"
"Expert small and hourly movers for condos and apartments in Mississauga. Reliable, efficient, and affordable moving help for any size relocation. Get a quote!","Mississauga","Port Credit, Streetsville, Erin Mills, Square One, Cooksville, Clarkson, Lakeview, Meadowvale","true","ON","Mississauga Small Movers | Condo & Apartment Relocation","Moving within Mississauga? Our team specializes in apartment and condo moves, expertly navigating everything from Square One-area high-rises to Port Credit townhouses. We know the city's buildings and work within elevator booking windows to keep your move on schedule.","Small & Hourly Movers in Mississauga","(289) 800-2197","Ontario","mississauga","6996593c621530eb2807bf87","2026-02-19T00:28:44.305000","2026-02-19T00:50:42.670000","698695f1c74216ef773f0181","jordan@chasethevibe.ca","false"
"Professional small moving services for condos and apartments in Ottawa. Enjoy hourly rates and efficient moving help across the capital. Request your free quote today!","Ottawa","Centretown, The Glebe, ByWard Market, Kanata, Nepean, Orleans, Barrhaven, Westboro, Hintonburg","true","ON","Ottawa Condo & Apartment Movers  | Small Moves & Hourly Rates","Navigate your Ottawa apartment or condo move with confidence. Our experienced movers are familiar with the capital's unique building rules, elevator schedules, and parking restrictions — from the ByWard Market to Kanata — ensuring a stress-free relocation in any neighbourhood.","Small & Hourly Movers in Ottawa","(289) 800-2197","Ontario","ottawa","6996593c621530eb2807bf89","2026-02-19T00:28:44.305000","2026-02-19T00:51:00.927000","698695f1c74216ef773f0181","jordan@chasethevibe.ca","false"
"Affordable small movers in Campbell River, BC. Pay by the hour for apartment moves, furniture delivery, and small loads on Vancouver Island. Call (236) 506-5898.","Campbell River","Willow Point, Downtown, Campbellton, Quinsam Heights, Southgate, Gold River Road","true","BC","Small Movers in Campbell River, BC | Affordable Hourly Moving","Campbell River stretches along the Discovery Passage, and whether you're moving between apartments near Shoppers Row or relocating to a home in the Willow Point area, our small movers are here to help. We specialize in the smaller jobs that don't justify a full moving truck — fast, affordable, and local.","Small & Hourly Movers in Campbell River, BC","(236) 506-5898","British Columbia","campbell-river","69951cb202cbf108be033a66","2026-02-18T01:58:10.415000","2026-02-18T01:58:10.415000","698695f1c74216ef773f0181","jordan@chasethevibe.ca","false"
"Affordable small movers in Duncan, BC. Pay by the hour for apartment moves, furniture delivery, and small loads in the Cowichan Valley. Call (236) 506-5898.","Duncan","Chemainus, Cobble Hill, Cowichan Bay, Lake Cowichan, Mill Bay, Ladysmith","true","BC","Small Movers in Duncan, BC | Affordable Hourly Moving","Duncan sits at the heart of the Cowichan Valley, and whether you're moving into a cozy cottage in Chemainus or shifting furniture between homes in Cobble Hill, our small movers make the process simple. We handle apartment moves, single-item deliveries, and downsizes without the cost of a full moving truck — fast, local, and affordable.","Small & Hourly Movers in Duncan, BC","(236) 506-5898","British Columbia","duncan","69951cb202cbf108be033a63","2026-02-18T01:58:10.415000","2026-02-18T01:58:10.415000","698695f1c74216ef773f0181","jordan@chasethevibe.ca","false"
"Affordable small movers in Penticton, BC. Pay by the hour for apartment moves, furniture delivery, and small loads in the Okanagan. Call (236) 506-5898.","Penticton","Main Street, Channel Parkway, Wiltse, Carmi, Uplands, Skaha Lake","true","BC","Small Movers in Penticton, BC | Affordable Hourly Moving","Penticton sits between Okanagan and Skaha Lakes, and whether you're moving into a lakefront condo or a hillside home in the South Okanagan, our small movers make it easy. We handle apartment moves, single-room relocations, and furniture deliveries without charging you for a truck you don't need.","Small & Hourly Movers in Penticton, BC","(236) 506-5898","British Columbia","penticton","69951cb202cbf108be033a65","2026-02-18T01:58:10.415000","2026-02-18T01:58:10.415000","698695f1c74216ef773f0181","jordan@chasethevibe.ca","false"
"Affordable small movers in Port Moody, BC. Pay by the hour for condo moves, apartment relocations, and small loads. Call (236) 506-5898.","Port Moody","Moody Centre, Inlet Centre, College Park, Glenayre, Heritage Mountain, Pleasantside","true","BC","Small Movers in Port Moody, BC | Affordable Hourly Moving","Port Moody's mix of condos along Inlet Centre and older homes near Rocky Point means moving logistics vary a lot. Whether you're relocating within Moody Centre or moving into one of the newer developments along Murray Street, our hourly movers give you flexible, affordable help without the full-truck cost.","Small & Hourly Movers in Port Moody, BC","(236) 506-5898","British Columbia","port-moody","69951cb202cbf108be033a64","2026-02-18T01:58:10.415000","2026-02-18T01:58:10.415000","698695f1c74216ef773f0181","jordan@chasethevibe.ca","false"
"Affordable small movers in Lethbridge, AB. Hourly rates, flexible scheduling, and careful handling of your belongings.","Lethbridge","Downtown, University, London Road, West Lethbridge, Copperwood, Heritage Heights","true","AB","Lethbridge Small & Hourly Movers Near Me","Lethbridge moves require local knowledge of the city's unique layout and neighborhoods. Our small moving teams are ready to help with apartment moves, furniture delivery, and quick relocations across the Oldman River valley.","Lethbridge Small & Hourly Movers","(403) 578-2467","Alberta","lethbridge","698ebea2e8665fbabe963e47","2026-02-13T06:03:14.221000","2026-02-13T06:03:14.221000","698695f1c74216ef773f0181","jordan@chasethevibe.ca","false"
"Medicine Hat's small & hourly moving service. No truck minimums, affordable rates, same-day availability.","Medicine Hat","Downtown, Southlands, Crescent Heights, Riverside, West End, Ross Glen","true","AB","Small & Hourly Movers Near Me in Medicine Hat","Medicine Hat moves are straightforward with our local small moving crews. From downtown to Southlands and beyond, we handle furniture pickups, apartment relocations, and small deliveries with care and efficiency.","Small & Hourly Movers in Medicine Hat","(403) 578-2467","Alberta","medicine-hat","698ebea2e8665fbabe963e48","2026-02-13T06:03:14.221000","2026-02-13T06:03:14.221000","698695f1c74216ef773f0181","jordan@chasethevibe.ca","false"
"Affordable small & hourly moving services in Calgary, AB. Pay by the hour, no truck minimums. Book same-day moves today.","Calgary","Beltline, Kensington, Inglewood, Mission, Bridgeland, Marda Loop, Bowness, Forest Lawn","true","AB","Small & Hourly Movers Near Me in Calgary | Mini Moves","Calgary moves require navigating everything from downtown high-rises to suburban communities across the Bow River. Whether you're relocating within Beltline, Kensington, or out to Airdrie, our small moving crews handle furniture pickups, condo moves, and local deliveries with care and efficiency.","Small & Hourly Movers in Calgary for Mini Moves","(403) 578-2467","Alberta","calgary","698ebea2e8665fbabe963e44","2026-02-13T06:03:14.221000","2026-03-07T01:25:57.233000","698695f1c74216ef773f0181","jordan@chasethevibe.ca","false"
"Edmonton's trusted small moving service. Hourly rates, no hidden fees. Perfect for apartments, condos, and small loads.","Edmonton","Old Strathcona, Whyte Avenue, University, Downtown, Garneau, Bonnie Doon, Jasper Avenue, Oliver","true","AB","Edmonton Small & Hourly Movers Near Me","Edmonton moves span from Old Strathcona to the University area and beyond the North Saskatchewan River. Our small moving teams are perfect for apartment relocations, furniture pickups, and quick deliveries across the city's diverse neighborhoods.","Edmonton Small & Hourly Movers","(403) 578-2467","Alberta","edmonton","698ebea2e8665fbabe963e45","2026-02-13T06:03:14.221000","2026-02-13T06:03:14.221000","698695f1c74216ef773f0181","jordan@chasethevibe.ca","false"
"Red Deer small movers offering affordable hourly rates. No truck minimums, same-day service available.","Red Deer","Bower, Timberlands, Downtown, Vanier Woods, Oriole Park, Hunting Hills, Westpark","true","AB","Small & Hourly Movers Near Me in Red Deer","Red Deer moves are quick and straightforward, whether you're in Bower, Timberlands, or downtown. Our small crews handle everything from single-item furniture moves to small apartment relocations efficiently and affordably.","Small & Hourly Movers in Red Deer","(403) 578-2467","Alberta","red-deer","698ebea2e8665fbabe963e46","2026-02-13T06:03:14.221000","2026-02-13T06:03:14.221000","698695f1c74216ef773f0181","jordan@chasethevibe.ca","false"
"Airdrie small movers with hourly rates. No truck minimums, fast and affordable service for your move.","Airdrie","Bayside, Williamstown, Coopers Crossing, Kings Heights, Hillcrest, Ravenswood","true","AB","Small & Hourly Movers Near Me in Airdrie","Airdrie moves often connect to Calgary and surrounding areas. Our small moving teams handle everything from single furniture pieces to complete apartment relocations efficiently across the city's residential neighborhoods.","Small & Hourly Movers in Airdrie","(403) 578-2467","Alberta","airdrie","698ebea2e8665fbabe963e4a","2026-02-13T06:03:14.221000","2026-02-13T06:03:14.221000","698695f1c74216ef773f0181","jordan@chasethevibe.ca","false"
"St. Albert small & hourly movers. Affordable rates, flexible scheduling, and careful handling of your belongings.","St. Albert","Downtown, Lacombe Park, Erin Ridge, Deer Ridge, Heritage Lakes, Braeside","true","AB","Small & Hourly Movers Near Me in St. Albert","St. Albert moves often connect to Edmonton and surrounding communities. Our small moving teams are perfect for apartment moves, furniture pickups, and quick deliveries across this family-friendly city.","Small & Hourly Movers in St. Albert","(403) 578-2467","Alberta","st-albert","698ebea2e8665fbabe963e4c","2026-02-13T06:03:14.221000","2026-02-13T06:03:14.221000","698695f1c74216ef773f0181","jordan@chasethevibe.ca","false"
"Grande Prairie small moving services. Pay by the hour, no hidden fees. Perfect for condos and small loads.","Grande Prairie","Downtown, Westpointe, Crystal Ridge, Cobblestone, Hawk Hills, Patterson","true","AB","Grande Prairie Small & Hourly Movers Near Me","Grande Prairie moves require reliable service across the city's growing communities. Our small moving crews are perfect for apartment relocations, furniture delivery, and quick local moves throughout the area.","Grande Prairie Small & Hourly Movers","(403) 578-2467","Alberta","grande-prairie","698ebea2e8665fbabe963e49","2026-02-13T06:03:14.221000","2026-02-13T06:03:14.221000","698695f1c74216ef773f0181","jordan@chasethevibe.ca","false"
"Fort McMurray's trusted small moving service. Hourly rates, no minimums, perfect for apartments and condos.","Fort McMurray","Waterways, Timberlea, Thickwood Heights, Abasand, Beacon Hill, Eagle Ridge","true","AB","Fort McMurray Small & Hourly Movers Near Me","Fort McMurray moves require understanding of the city's unique layout and communities. Our small moving crews provide reliable service for apartment relocations, furniture delivery, and local moves throughout the area.","Fort McMurray Small & Hourly Movers","(403) 578-2467","Alberta","fort-mcmurray","698ebea2e8665fbabe963e4b","2026-02-13T06:03:14.221000","2026-02-13T06:03:14.221000","698695f1c74216ef773f0181","jordan@chasethevibe.ca","false"
"Affordable moving and delivery on Salt Spring Island and off-island to Victoria, Duncan, and Nanaimo. $85/hr per mover. Book your island move today.","Salt Spring Island","Ganges, Fulford Harbour, Vesuvius, Long Harbour, Beaver Point, Cusheon Lake","true","BC","Salt Spring Island Small Movers & Off-Island Delivery","Salt Spring Island moves require careful coordination—whether you're relocating within Ganges, moving between Fulford and Vesuvius, or need off-island delivery to Victoria, Duncan, or Nanaimo. Our movers handle BC Ferries logistics, tight timelines, and everything from studio apartments to furniture pickups, making island moves stress-free.","Small Movers & Off-Island Delivery on Salt Spring Island","1-800-MOVE-NOW","British Columbia","salt-spring-island","698bc7926a2a931cc9ed5830","2026-02-11T00:04:34.927000","2026-02-11T00:09:45.367000","698695f1c74216ef773f0181","jordan@chasethevibe.ca","false"
"Hire our small movers for those jobs the big moving companies want to much for. Same day service available!","Victoria","Downtown Victoria, James Bay, Oak Bay, Fernwood, Fairfield, Saanich, Esquimalt, Langford","true","BC","Victoria Small & Hourly Movers | $85/hr | Mini Moves","Victoria's compact downtown and island lifestyle mean small moves are common. From James Bay condos to Oak Bay homes, Fernwood to Saanich, our movers handle furniture pickups, apartment moves, and deliveries across the capital region—fast and affordable.","Small & Hourly Movers in Victoria for Mini Moves","","British Columbia","victoria","6986d5901f264491932665ec","2026-02-07T06:02:56.162000","2026-03-07T01:31:05.205000","698695f1c74216ef773f0181","jordan@chasethevibe.ca","false"
"Affordable small and hourly movers in Vancouver. $85/hr per mover. Perfect for condos, apartments, and small loads. Call us today.","Vancouver","Downtown, Yaletown, Kitsilano, West End, Commercial Drive, Mount Pleasant, Fairview, Strathcona","true","BC","Vancouver Small & Hourly Movers Near Me | $85/hr","Vancouver's high-rise condos and tight parking make small moves a challenge. Whether you're moving in Yaletown, Kitsilano, the West End, or Commercial Drive, our hourly movers navigate the city efficiently and affordably—no full-truck minimums required.","Small & Hourly Movers in Vancouver","","British Columbia","vancouver","6986d5901f264491932665eb","2026-02-07T06:02:56.162000","2026-02-11T00:09:17.713000","698695f1c74216ef773f0181","jordan@chasethevibe.ca","false"
"Affordable small and hourly movers in Chilliwack, BC. $85/hr per mover. Perfect for apartments, furniture, and small loads. Call us today.","Chilliwack","Sardis, Promontory, Rosedale, Yarrow, Vedder Crossing, Cultus Lake","true","BC","Chilliwack Small & Hourly Movers Near Me","Chilliwack's mix of rural properties and urban growth means people often need movers for smaller jobs. Whether you're in Sardis, moving to Promontory, or hauling something from Rosedale to Yarrow, our hourly movers make it affordable and stress-free.","Small & Hourly Movers in Chilliwack","","British Columbia","chilliwack","69869bbd2aed21d737de61fe","2026-02-07T01:56:13.562000","2026-02-11T00:09:30.338000","698695f1c74216ef773f0181","jordan@chasethevibe.ca","false"
"Small and hourly movers in Nanaimo, BC. $85/hr per mover. Ideal for condos, furniture pickups, and small loads. Book today.","Nanaimo","Old City Quarter, Departure Bay, South End, Harewood, North Nanaimo, Lantzville","true","BC","Nanaimo Small & Hourly Movers Near Me","Nanaimo's waterfront condos and island lifestyle mean people are always moving smaller loads, buying second-hand furniture, or downsizing. Whether you're in Old City Quarter, Departure Bay, or south end near the Parkway, our hourly movers get the job done fast and affordably.","Small & Hourly Movers in Nanaimo","","British Columbia","nanaimo","69869bbd2aed21d737de61ef","2026-02-07T01:56:13.562000","2026-02-11T00:09:29.631000","698695f1c74216ef773f0181","jordan@chasethevibe.ca","false"
"Hourly movers in Maple Ridge, BC. $85/hr per mover. Small moves, furniture hauling, and delivery. Affordable and reliable.","Maple Ridge","Albion, Haney, Silver Valley, Thornhill, Whonnock, Pitt Meadows","true","BC","Maple Ridge Small & Hourly Movers Near Me","Maple Ridge and Pitt Meadows residents often find that big movers charge way too much for small jobs. Whether you're moving within Albion, hauling a dresser from Haney, or heading across to Mission, our hourly movers offer a smarter, more affordable option.","Small & Hourly Movers in Maple Ridge","","British Columbia","maple-ridge","69869bbd2aed21d737de61f6","2026-02-07T01:56:13.562000","2026-02-11T00:09:36.023000","698695f1c74216ef773f0181","jordan@chasethevibe.ca","false"
"Affordable small and hourly movers in Port Coquitlam, BC. $85/hr per mover. Perfect for condos, furniture, and small loads. Book now.","Port Coquitlam","Downtown PoCo, Citadel Heights, Riverwood, Mary Hill, Lincoln Park","true","BC","Port Coquitlam Small & Hourly Movers Near Me","Port Coquitlam's suburban homes and growing condo market make it a perfect fit for our hourly moving service. Whether you're moving within PoCo, heading to neighboring Coquitlam, or picking up furniture from Pitt Meadows, we keep it simple and affordable.","Small & Hourly Movers in Port Coquitlam","","British Columbia","port-coquitlam","69869bbd2aed21d737de61fb","2026-02-07T01:56:13.562000","2026-02-11T00:09:40.187000","698695f1c74216ef773f0181","jordan@chasethevibe.ca","false"
