meta_description,city_name,neighbourhoods,is_active,province,meta_title,local_paragraph,h1_heading,phone_number,province_full,slug,id,created_date,updated_date,created_by_id,created_by,is_sample
"Looking for small & hourly movers in Saskatoon? Pay by the hour with no hidden fees. Local movers serving Saskatoon and surrounding neighbourhoods. Call (639) 638-8439.","Saskatoon","Nutana, Stonebridge, Evergreen, Holliston, Silverspring, Hampton Village, Willowgrove, Arbor Creek","true","SK","Saskatoon Small & Hourly Movers Near Me | Affordable Moving Services","Whether you're moving between Nutana, Stonebridge, or Evergreen, our Saskatoon movers handle small loads and apartment moves without the big-truck price tag. From condo moves along the South Saskatchewan River to local furniture deliveries across the city, we keep it simple and affordable.","Saskatoon Small & Hourly Movers Near Me","(639) 638-8439","Saskatchewan","saskatoon","69c1b4403f3f98a18338a70c","2026-03-23T21:44:32.747000","2026-03-23T21:44:32.747000","698695f1c74216ef773f0181","jordan@chasethevibe.ca","false"
"Small & hourly moving services in Swift Current, Saskatchewan. Pay by the hour, no truck minimums. Reliable local movers for apartments and small loads. Call (639) 638-8439.","Swift Current","Riverview, Elmview, Northwest, Kinetic Park, South Hill, Central","true","SK","Small & Hourly Movers in Swift Current, SK | Affordable Moving","Swift Current's compact city layout makes hourly moving a smart choice — most moves across town take just a couple of hours. Whether you're moving within the Riverview area, across to the north end, or need help with a furniture delivery, we've got you covered.","Small & Hourly Movers in Swift Current, SK","(639) 638-8439","Saskatchewan","swift-current","69c1b4403f3f98a18338a710","2026-03-23T21:44:32.747000","2026-03-23T21:44:32.747000","698695f1c74216ef773f0181","jordan@chasethevibe.ca","false"
"Small & hourly movers in Prince Albert, SK. Pay by the hour with no hidden fees. Local moving help for apartments, condos, and small loads. Call (639) 638-8439.","Prince Albert","River Heights, Carlton Park, Midtown, West Flat, East Hill, Nordale","true","SK","Prince Albert Small & Hourly Movers Near Me | Affordable Moving","Prince Albert's mix of riverfront homes, older neighbourhoods, and newer subdivisions means every move is different. Our hourly movers make quick work of small loads and local moves across PA — whether you're heading across town or just need a hand with furniture.","Prince Albert Small & Hourly Movers Near Me","(639) 638-8439","Saskatchewan","prince-albert","69c1b4403f3f98a18338a70e","2026-03-23T21:44:32.747000","2026-03-23T21:44:32.747000","698695f1c74216ef773f0181","jordan@chasethevibe.ca","false"
"Affordable hourly movers in Regina, Saskatchewan. No truck minimums, pay only for what you need. Serving Wascana, Harbour Landing, and all Regina neighbourhoods. Call (639) 638-8439.","Regina","Harbour Landing, Wascana, Cathedral, Lakeview, Glencairn, Normanview, Greens on Gardiner, Eastview","true","SK","Small & Hourly Movers in Regina, SK | Affordable Moving Services","From Harbour Landing condos to Wascana Centre apartments, Regina moves come in all shapes and sizes. Our hourly movers handle everything from single-bedroom suites to small office relocations across the Queen City — fast, affordable, and with no surprise charges.","Small & Hourly Movers in Regina, Saskatchewan","(639) 638-8439","Saskatchewan","regina","69c1b4403f3f98a18338a70d","2026-03-23T21:44:32.747000","2026-03-23T21:44:32.747000","698695f1c74216ef773f0181","jordan@chasethevibe.ca","false"
"Affordable small & hourly movers in Moose Jaw, Saskatchewan. Pay by the hour, no minimums. Helping with apartments, furniture moves, and small loads. Call (639) 638-8439.","Moose Jaw","Crescent Park, River Heights, Palliser, Westmount, Northwest, Southeast","true","SK","Small & Hourly Movers in Moose Jaw, SK | Affordable Moving Services","From Heritage neighbourhoods near Crescent Park to newer areas on the west side, Moose Jaw moves don't need to cost a fortune. Our movers work by the hour so you only pay for the time you need — perfect for apartments, single-item deliveries, and local moves.","Small & Hourly Movers in Moose Jaw, SK","(639) 638-8439","Saskatchewan","moose-jaw","69c1b4403f3f98a18338a70f","2026-03-23T21:44:32.747000","2026-03-23T21:44:32.747000","698695f1c74216ef773f0181","jordan@chasethevibe.ca","false"
"Affordable hourly movers in Pickering, Ontario. Pay only for the time you need. Condo, apartment & small home moves starting at $85/hr. Call (289) 800-2197.","Pickering","Bay Ridges, Duffins Heights, Rosebank, Liverpool, Amberlea, Dunbarton","true","ON","Small & Hourly Movers in Pickering, ON | Local Moving Help","Pickering is a growing community along Lake Ontario's north shore, with everything from waterfront condos in Bay Ridges to newer subdivisions in Duffins Heights. Our small moving crews know how to navigate Pickering's mix of older townhomes and newer builds efficiently. Whether you're moving near Pickering Town Centre or crossing into Ajax or Durham Region, we keep the clock honest and the process simple.","Small & Hourly Movers in Pickering","(289) 800-2197","Ontario","pickering","69b868dfa13b4bd3103051a0","2026-03-16T20:32:31.655000","2026-03-16T20:32:31.655000","698695f1c74216ef773f0181","jordan@chasethevibe.ca","false"
"Local hourly movers serving Chatham-Kent, Ontario. Small moves, apartment & home relocations starting at $85/hr. Transparent pricing. Call (289) 800-2197.","Chatham-Kent","Chatham, Wallaceburg, Blenheim, Tilbury, Ridgetown, Wheatley","true","ON","Chatham-Kent Small Movers Near Me | Hourly Moving Help ON","Chatham-Kent is a sprawling municipality covering everything from the city of Chatham to smaller communities like Wallaceburg, Blenheim, and Tilbury. Our small moving crews travel throughout the region and are well-suited for the kind of residential moves common in this area — houses, apartments, and smaller loads that don't need a full 53-foot truck. We charge by the hour so you only pay for what you actually need.","Chatham-Kent Small & Hourly Movers Near Me","(289) 800-2197","Ontario","chatham-kent","69b868dfa13b4bd3103051a3","2026-03-16T20:32:31.655000","2026-03-16T20:32:31.655000","698695f1c74216ef773f0181","jordan@chasethevibe.ca","false"
"Local hourly movers in Niagara Falls, Ontario. Small moves, condo & apartment relocations starting at $85/hr. No hidden fees. Call (289) 800-2197 today.","Niagara Falls","Stamford, Chippawa, Drummond, Niagara South, Cherrywood Acres, Shriner's Creek","true","ON","Niagara Falls Small Movers Near Me | Hourly Moving Services ON","Niagara Falls is a city of contrasts — tourist corridors on one side and tight-knit residential neighbourhoods like Stamford and Chippawa on the other. Our movers are familiar with the region's streets, whether you're moving out of a Clifton Hill-area rental or relocating within a quiet neighbourhood off Mountain Road. We serve Niagara Falls and the surrounding Niagara Region with honest hourly rates and no surprise fees.","Niagara Falls Small & Hourly Movers Near Me","(289) 800-2197","Ontario","niagara-falls","69b868dfa13b4bd3103051a1","2026-03-16T20:32:31.655000","2026-03-16T20:32:31.655000","698695f1c74216ef773f0181","jordan@chasethevibe.ca","false"
"Affordable hourly movers in Peterborough, Ontario. Apartment, condo & small home moves from $85/hr. No hidden fees. Same-day available. Call (289) 800-2197.","Peterborough","Downtown, Ashburnham, East City, Monaghan, Trent University area, South End","true","ON","Small & Hourly Movers in Peterborough, ON | Local Moving Help","Peterborough is a mid-sized city with a strong student population thanks to Trent University, which means a steady demand for affordable, flexible moving help. From downtown apartments near Hunter Street to quieter neighbourhoods in the East End and Ashburnham, our hourly movers handle it all without the big-company pricing. Whether you're moving in for the school year or relocating within the city, we keep it simple and affordable.","Small & Hourly Movers in Peterborough","(289) 800-2197","Ontario","peterborough","69b868dfa13b4bd3103051a4","2026-03-16T20:32:31.655000","2026-03-16T20:32:31.655000","698695f1c74216ef773f0181","jordan@chasethevibe.ca","false"
"Affordable small and hourly movers in Sarnia, Ontario. Apartment, condo & small home moves from $85/hr. Honest pricing, no hidden fees. Call (289) 800-2197.","Sarnia","Brights Grove, Canatara, Lakeshore, downtown Sarnia, London Road, Point Edward","true","ON","Small & Hourly Movers in Sarnia, ON | Affordable Local Movers","Sarnia sits at the southern tip of Lake Huron and is known for its mix of waterfront properties, downtown rentals, and residential neighbourhoods like Brights Grove and Canatara. Our hourly moving teams are sized for smaller loads — perfect for the kind of apartment and condo moves that are common in Sarnia's urban core. Skip the flat-rate truck companies and pay only for the hours you actually use.","Small & Hourly Movers in Sarnia","(289) 800-2197","Ontario","sarnia","69b868dfa13b4bd3103051a2","2026-03-16T20:32:31.655000","2026-03-16T20:32:31.655000","698695f1c74216ef773f0181","jordan@chasethevibe.ca","false"
"Affordable small movers in Ajax, ON. $85/hr for 1 mover, $140/hr for 2. Furniture moves, condo & apartment relocations, same-day available. Call (289) 800-2197.","Ajax","Central Ajax, South Ajax, Pickering Village, Riverside, Westney Heights, Northwest Ajax","true","ON","Small Movers Ajax ON | Hourly Moving Services | Small Movers Canada","Ajax is a thriving Durham Region community with a growing number of townhomes, detached houses, and lakeside condos. Whether you're moving between neighbourhoods in Ajax or heading cross-town along Kingston Road, our small moving teams offer fast, hourly-rate service without the cost of a full moving truck.","Ajax Small & Hourly Movers Near Me","(289) 800-2197","Ontario","ajax","69a78d0c063bb995248db737","2026-03-04T01:38:20.278000","2026-03-04T01:38:20.278000","698695f1c74216ef773f0181","jordan@chasethevibe.ca","false"
"Affordable small movers in Cambridge, ON. Hourly rates from $85/hr. Furniture moves, apartment & condo relocations, same-day available. Call (289) 800-2197.","Cambridge","Galt, Preston, Hespeler, Westway, Elgin Street, Northview, Blair","true","ON","Small Movers Cambridge ON | Hourly Moving Services | Mini Moves","Cambridge sits at the junction of Galt, Preston, and Hespeler — three distinct communities with their own neighbourhoods, street layouts, and housing styles. Whether you're moving a few pieces of furniture across Galt's heritage streets or relocating an apartment near the Grand River, our hourly movers handle it quickly and affordably. No full-truck minimums, just fair hourly rates.","Small & Hourly Movers in Cambridge","(289) 800-2197","Ontario","cambridge","69a78d0c063bb995248db734","2026-03-04T01:38:20.278000","2026-03-07T01:25:34.612000","698695f1c74216ef773f0181","jordan@chasethevibe.ca","false"
"Affordable small movers in East York, ON. $85/hr for 1 mover, $140/hr for 2. Apartment moves, furniture delivery & small loads. Call (289) 800-2197.","East York","Danforth Village, Pape Village, Woodbine Heights, Crescent Town, Leaside border, O'Connor Hills","true","ON","Small Movers East York ON | Hourly Moving Services | Small Movers Canada","East York is one of Toronto's most established inner-city communities, packed with semi-detached homes, basement apartments, and mid-rise buildings along Danforth and Pape. Our small moving teams are experienced navigating narrow driveways, front porch steps, and tight staircases — the everyday realities of moving in East York. Pay only for the hours you need.","East York Small & Hourly Movers Near Me","(289) 800-2197","Ontario","east-york","69a78d0c063bb995248db735","2026-03-04T01:38:20.278000","2026-03-04T01:38:20.278000","698695f1c74216ef773f0181","jordan@chasethevibe.ca","false"
"Affordable small movers in Brantford, ON. Hourly rates from $85/hr. Furniture moves, apartment relocations & small loads. Call (289) 800-2197.","Brantford","Downtown Brantford, Eagle Place, West Brant, Holmedale, Henderson Survey, Elgin Street, Greenbrier","true","ON","Small Movers Brantford ON | Hourly Moving Services | Small Movers Canada","Brantford is a mid-sized city with a growing mix of new subdivisions, heritage homes downtown, and student rentals near Wilfrid Laurier's Brantford campus. Our hourly movers cover the whole city — from Eagle Place to West Brant — giving you a flexible, affordable option whether you're moving a single item or a small apartment.","Small & Hourly Movers in Brantford","(289) 800-2197","Ontario","brantford","69a78d0c063bb995248db736","2026-03-04T01:38:20.278000","2026-03-04T01:38:20.278000","698695f1c74216ef773f0181","jordan@chasethevibe.ca","false"
"Affordable small movers in Milton, ON. Hourly rates from $85/hr. Furniture moves, condo & apartment relocations, same-day available. Call (289) 800-2197.","Milton","Bronte Meadows, Timberlea, Beaty, Coates, Clarke, Harrison, Scott, Hawthorne Village","true","ON","Small Movers Milton ON | Hourly Moving Services | Small Movers Canada","Milton is one of Canada's fastest-growing communities, with new townhomes, semis, and condo developments expanding rapidly near the 401 corridor and Derry Road. Our small moving teams are experienced with tight driveways, new-build neighbourhoods, and quick cross-town moves in Milton's growing grid. Pay by the hour — no wasted truck space.","Small & Hourly Movers in Milton","(289) 800-2197","Ontario","milton","69a47d9250d9f9a689a44823","2026-03-01T17:55:30.329000","2026-03-01T17:55:30.329000","698695f1c74216ef773f0181","jordan@chasethevibe.ca","false"
"Affordable small movers in St. Catharines, ON. $85/hr for 1 mover, $140/hr for 2. Furniture moves, apartment & student relocations. Call (289) 800-2197.","St. Catharines","Downtown St. Catharines, Merritton, Port Dalhousie, Grantham, Facer, Fitzgerald, Lakeshore","true","ON","Small Movers St. Catharines ON | Hourly Moving | Small Movers Canada","St. Catharines is the heart of the Niagara Region, with a mix of student rentals near Brock University, established residential neighbourhoods, and waterfront condos. Our hourly movers handle everything from single-item furniture moves to full apartment relocations across the city — without the full-truck markup.","St. Catharines Small & Hourly Movers Near Me","(289) 800-2197","Ontario","st-catharines","69a47d9250d9f9a689a44824","2026-03-01T17:55:30.329000","2026-03-01T17:55:30.329000","698695f1c74216ef773f0181","jordan@chasethevibe.ca","false"
"Affordable small movers in Thunder Bay, ON. $85/hr for 1 mover, $140/hr for 2. Furniture moves, apartment relocations & small loads. Call (289) 800-2197.","Thunder Bay","Fort William, Port Arthur, Westfort, Current River, Intercity, Northwood, Neebing","true","ON","Small Movers Thunder Bay ON | Hourly Moving Services | Small Movers Canada","Thunder Bay spans two historic cores — Fort William and Port Arthur — with a diverse mix of bungalows, apartments, and student housing near Lakehead University. Our small moving teams cover the whole city, from Current River to the Intercity area, giving you affordable hourly moving without paying for a full truck you don't need.","Thunder Bay Small & Hourly Movers Near Me","(289) 800-2197","Ontario","thunder-bay","69a47d9250d9f9a689a44826","2026-03-01T17:55:30.329000","2026-03-01T17:55:30.329000","698695f1c74216ef773f0181","jordan@chasethevibe.ca","false"
"Affordable small movers in Kingston, ON. Hourly rates from $85/hr. Student moves, furniture delivery, small loads & apartment relocations. Call (289) 800-2197.","Kingston","Downtown Kingston, Sydenham, Cataraqui, Williamsville, Calvin Park, Portsmouth, Pittsburgh","true","ON","Small Movers Kingston ON | Hourly Moving Services | Small Movers Canada","Kingston is a vibrant university city where move-in and move-out season is a way of life. From Queen's University student apartments to heritage homes in Sydenham and new builds in Cataraqui, our small moving teams handle local Kingston moves efficiently and affordably — billed by the hour, not by the truckload.","Small & Hourly Movers in Kingston","(289) 800-2197","Ontario","kingston","69a47d9250d9f9a689a44825","2026-03-01T17:55:30.329000","2026-03-01T17:55:30.329000","698695f1c74216ef773f0181","jordan@chasethevibe.ca","false"
"Affordable small movers in Nepean, ON. Hourly rates starting at $85/hr. Furniture moves, condo moves, small loads & same-day service. Call (289) 800-2197.","Nepean","Barrhaven, Bells Corners, Centrepointe, Merivale, Craig Henry, Nepean Town Centre","true","ON","Small Movers Nepean ON | Hourly Moving Services | Small Movers Canada","Nepean is one of Ottawa's most established communities, with a mix of family homes, townhouses, and growing condo developments. Whether you're moving within Barrhaven, Bells Corners, or Centrepointe, our small moving teams handle local moves efficiently without the full-truck price tag. We know the neighbourhoods and the routes.","Small & Hourly Movers in Nepean","(289) 800-2197","Ontario","nepean","69a205eda1d2bbfb07071bb9","2026-02-27T21:00:29.750000","2026-02-27T21:00:29.750000","698695f1c74216ef773f0181","jordan@chasethevibe.ca","false"
"Affordable small movers in Greater Sudbury, ON. $85/hr for 1 mover, $140/hr for 2. Furniture moves, apartment moves & same-day service. Call (289) 800-2197.","Greater Sudbury","Downtown Sudbury, New Sudbury, Hanmer, Val Caron, Capreol, Lively, Chelmsford","true","ON","Small Movers Greater Sudbury ON | Hourly Moving | Small Movers Canada","Greater Sudbury spans a vast area with distinct communities from Downtown to Hanmer, Capreol, and Val Caron. Our small moving teams are equipped for Sudbury's varied housing stock — from older bungalows to newer apartment builds near New Sudbury Centre. Pay by the hour and only use the time you need.","Greater Sudbury Small & Hourly Movers Near Me","(289) 800-2197","Ontario","greater-sudbury","69a205eda1d2bbfb07071bba","2026-02-27T21:00:29.750000","2026-02-27T21:00:29.750000","698695f1c74216ef773f0181","jordan@chasethevibe.ca","false"
"Affordable small movers in Barrie, ON. Hourly rates starting at $85/hr. Condo moves, furniture delivery, small loads & same-day available. Call (289) 800-2197.","Barrie","Downtown Barrie, Allandale, Painswick, Holly, Ardagh Bluffs, South End, Bayfield Street","true","ON","Small Movers Barrie ON | Hourly Moving Services | Small Movers Canada","Barrie is one of Ontario's fastest-growing cities, with new condo towers along the waterfront and established neighbourhoods spreading toward Innisfil and Springwater. Our small moving teams handle local Barrie moves efficiently — from single-item deliveries to full condo or apartment relocations, all billed by the hour.","Small & Hourly Movers in Barrie","(289) 800-2197","Ontario","barrie","69a205eda1d2bbfb07071bbb","2026-02-27T21:00:29.750000","2026-02-27T21:00:29.750000","698695f1c74216ef773f0181","jordan@chasethevibe.ca","false"
"Affordable small movers in Guelph, ON. $85/hr for 1 mover, $140/hr for 2. Furniture moves, student moves, apartment relocations. Call (289) 800-2197.","Guelph","Downtown Guelph, University Area, Kortright West, Stone Road, Pineridge, Clairfields, Exhibition Park","true","ON","Small Movers Guelph ON | Hourly Moving Services | Small Movers Canada","Guelph is a vibrant university city with a growing downtown core and a steady stream of student and young professional moves. From the University of Guelph area to Stone Road, Kortright West, and the Old Quebec Street district, our hourly movers handle small loads, furniture moves, and apartment relocations without the big-company price tag.","Guelph Small & Hourly Movers Near Me","(289) 800-2197","Ontario","guelph","69a205eda1d2bbfb07071bbc","2026-02-27T21:00:29.750000","2026-02-27T21:00:29.750000","698695f1c74216ef773f0181","jordan@chasethevibe.ca","false"
"Small movers in Burlington, ON offering hourly rates. Perfect for apartments, condos & small loads in Alton, Brant Hills & downtown. Call (289) 800-2197.","Burlington","Downtown Burlington, Alton, Brant Hills, Tyandaga, Millcroft, Shoreacres, Headon Forest","true","ON","Burlington Small & Hourly Movers Near Me","Burlington sits between Hamilton and Oakville along Lake Ontario, with a lively downtown waterfront, mid-rise condos near the GO station, and family neighbourhoods in Alton and Tyandaga. Our small moving teams serve the full Burlington area — from lakefront condo buildings with freight elevator access to the suburban streets of Brant Hills and Millcroft. We keep moves in Burlington fast and affordable.","Small & Hourly Movers in Burlington","(289) 800-2197","Ontario","burlington","699e01cbcb2fde5a5477fb47","2026-02-24T19:53:47.673000","2026-02-24T19:56:47.192000","698695f1c74216ef773f0181","jordan@chasethevibe.ca","false"
"Need small movers in Etobicoke, ON? Hourly moving help for condos, apartments & small loads. No full-truck minimums. Call (289) 800-2197 for a free quote.","Etobicoke","Mimico, The Kingsway, Islington, Long Branch, Rexdale, Richview, Humber Bay","true","ON","Etobicoke Small & Hourly Movers Near Me","Etobicoke stretches from the Humber River to the city's western edge, offering a mix of lakeside condos in Mimico, mid-rise apartments along Bloor Street, and detached homes in neighbourhoods like The Kingsway and Islington. Our small moving teams are well-versed in Etobicoke's varied building types — from heritage houses with narrow driveways to modern condo towers with elevator booking requirements near the waterfront.","Etobicoke Small & Hourly Movers Near Me","(289) 800-2197","Ontario","etobicoke","699e01cbcb2fde5a5477fb44","2026-02-24T19:53:47.673000","2026-02-24T19:56:22.031000","698695f1c74216ef773f0181","jordan@chasethevibe.ca","false"
"Need small movers in Richmond Hill, ON? Hourly moving services for condos, townhomes & small loads in Oak Ridges, Langstaff & more. Call (289) 800-2197.","Richmond Hill","Oak Ridges, Langstaff, Mill Pond, Westbrook, Jefferson, Richvale, Crosby","true","ON","Small & Hourly Movers Richmond Hill","Richmond Hill is a diverse York Region city with high-density condo developments near Yonge Street and the future subway extension, as well as established family neighbourhoods in Oak Ridges and Mill Pond. Our small moving teams handle the full range of Richmond Hill moves — from busy condo towers along Highway 7 with strict elevator booking windows to quiet residential streets further north near the Oak Ridges Moraine.","Richmond Hill Small & Hourly Movers Near Me","(289) 800-2197","Ontario","richmond-hill","699e01cbcb2fde5a5477fb48","2026-02-24T19:53:47.673000","2026-02-24T19:57:12.073000","698695f1c74216ef773f0181","jordan@chasethevibe.ca","false"
"Affordable small movers in Oakville, ON. Hourly rates for apartments, condos & single-item moves in Old Oakville, Glen Abbey & more. Call (289) 800-2197.","Oakville","Old Oakville, Glen Abbey, River Oaks, Bronte, Uptown Core, Palermo, Joshua Creek","true","ON","Oakville Small & Hourly Movers Near Me","Oakville blends charming heritage streets in Old Oakville with modern high-rises and executive townhomes near the GO station. Whether you're moving a few pieces of furniture from a lakeside condo or relocating between homes in Glen Abbey or River Oaks, our small moving teams make it simple. We handle everything from tight Victorian-era laneways downtown to wide suburban cul-de-sacs in North Oakville.","Oakville Small & Hourly Movers Near Me","(289) 800-2197","Ontario","oakville","699e01cbcb2fde5a5477fb46","2026-02-24T19:53:47.673000","2026-02-24T19:56:13.091000","698695f1c74216ef773f0181","jordan@chasethevibe.ca","false"
"Small movers in Vaughan, ON with hourly rates. Perfect for condos, townhomes & small loads in Woodbridge, Maple & Thornhill. Call (289) 800-2197.","Vaughan","Woodbridge, Maple, Thornhill, Kleinburg, Concord, Vaughan Metropolitan Centre, Nashville","true","ON","Vaughan Small & Hourly Movers Near Me","Vaughan is one of the GTA's fastest-growing cities, with sprawling townhome communities in Woodbridge, new condos near the VMC subway station, and established neighbourhoods in Maple and Thornhill. Our small moving teams know Vaughan well — from navigating the gated communities off Highway 400 to handling elevator moves in the rapidly developing Vaughan Metropolitan Centre.","Small & Hourly Movers in Vaughan","(289) 800-2197","Ontario","vaughan","699e01cbcb2fde5a5477fb45","2026-02-24T19:53:47.673000","2026-02-24T19:56:37.589000","698695f1c74216ef773f0181","jordan@chasethevibe.ca","false"
"Looking for small movers in Windsor, ON? Hourly moving services for apartments and small loads. No full-truck minimums. Call (289) 800-2197.","Windsor","Walkerville, South Windsor, East Windsor, Riverside, Sandwich, Ford City, University District","true","ON","Small & Hourly Movers Windsor","Windsor sits at the tip of southwestern Ontario, right across from Detroit, with a mix of older brick homes in Walkerville, riverside condos downtown, and suburban neighbourhoods in South Windsor and East Windsor. Our small moving teams know this city's unique layout — from the narrow streets near the waterfront to the wide suburban avenues further out. We make Windsor moves simple and affordable.","Small & Hourly Movers in Windsor","(289) 800-2197","Ontario","windsor","6999e9dd52dd2b3e6bada9a2","2026-02-21T17:22:37.530000","2026-02-24T19:57:45.993000","698695f1c74216ef773f0181","jordan@chasethevibe.ca","false"
